{"created_at":"2026-10-05T05:07:35.444Z","facts":[{"certainty":"inferred","counterexamples":5,"evidence":[{"artifact_ids":["image-471506b0-de28-44e6-bb9b-ae706e35b161-0","image-471506b0-de28-44e6-bb9b-ae706e35b161-1"],"observation_ids":["observation-0","observation-1"],"record_seq":23,"source_id":"source-e86455e4a865e4b50486bcfe604a6ea6a8e5e8dbb9b49f7c455e65608c2a3c1d"},{"artifact_ids":["image-471506b0-de28-44e6-bb9b-ae706e35b161-10","image-471506b0-de28-44e6-bb9b-ae706e35b161-11"],"observation_ids":["observation-10","observation-11"],"record_seq":124,"source_id":"source-e86455e4a865e4b50486bcfe604a6ea6a8e5e8dbb9b49f7c455e65608c2a3c1d"},{"artifact_ids":["image-471506b0-de28-44e6-bb9b-ae706e35b161-20","image-471506b0-de28-44e6-bb9b-ae706e35b161-21"],"observation_ids":["observation-20","observation-21"],"record_seq":225,"source_id":"source-e86455e4a865e4b50486bcfe604a6ea6a8e5e8dbb9b49f7c455e65608c2a3c1d"},{"artifact_ids":["image-471506b0-de28-44e6-bb9b-ae706e35b161-30","image-471506b0-de28-44e6-bb9b-ae706e35b161-31"],"observation_ids":["observation-30","observation-31"],"record_seq":325,"source_id":"source-e86455e4a865e4b50486bcfe604a6ea6a8e5e8dbb9b49f7c455e65608c2a3c1d"},{"artifact_ids":["image-471506b0-de28-44e6-bb9b-ae706e35b161-40","image-471506b0-de28-44e6-bb9b-ae706e35b161-41"],"observation_ids":["observation-40","observation-41"],"record_seq":426,"source_id":"source-e86455e4a865e4b50486bcfe604a6ea6a8e5e8dbb9b49f7c455e65608c2a3c1d"}],"id":"fact-0ae69f329f14e24b8f1f7f95c0c1161e4f00b6421d9d98291bba871a16f123d4","kind":"experience","metrics":{"authorizes_actions":false,"avoid_movement":true,"effect_unknown_count":5,"recommended_wait_ms":250,"requires_arrival_evidence":true},"sample_count":5,"scope":{"journal_complete":true,"layout":"3840x2160","mode":"live","skill":"move_for","test_target":false},"statement":"在缺少到达观察证据时，建议等待或升级感知；该建议不授权动作，也不证明运动失败。"},{"certainty":"observed","counterexamples":0,"evidence":[{"artifact_ids":["image-471506b0-de28-44e6-bb9b-ae706e35b161-8","image-471506b0-de28-44e6-bb9b-ae706e35b161-9"],"observation_ids":["observation-8","observation-9"],"record_seq":104,"source_id":"source-e86455e4a865e4b50486bcfe604a6ea6a8e5e8dbb9b49f7c455e65608c2a3c1d"},{"artifact_ids":["image-471506b0-de28-44e6-bb9b-ae706e35b161-18","image-471506b0-de28-44e6-bb9b-ae706e35b161-19"],"observation_ids":["observation-18","observation-19"],"record_seq":205,"source_id":"source-e86455e4a865e4b50486bcfe604a6ea6a8e5e8dbb9b49f7c455e65608c2a3c1d"},{"artifact_ids":["image-471506b0-de28-44e6-bb9b-ae706e35b161-28","image-471506b0-de28-44e6-bb9b-ae706e35b161-29"],"observation_ids":["observation-28","observation-29"],"record_seq":305,"source_id":"source-e86455e4a865e4b50486bcfe604a6ea6a8e5e8dbb9b49f7c455e65608c2a3c1d"},{"artifact_ids":["image-471506b0-de28-44e6-bb9b-ae706e35b161-38","image-471506b0-de28-44e6-bb9b-ae706e35b161-39"],"observation_ids":["observation-38","observation-39"],"record_seq":406,"source_id":"source-e86455e4a865e4b50486bcfe604a6ea6a8e5e8dbb9b49f7c455e65608c2a3c1d"},{"artifact_ids":["image-471506b0-de28-44e6-bb9b-ae706e35b161-48","image-471506b0-de28-44e6-bb9b-ae706e35b161-49"],"observation_ids":["observation-48","observation-49"],"record_seq":506,"source_id":"source-e86455e4a865e4b50486bcfe604a6ea6a8e5e8dbb9b49f7c455e65608c2a3c1d"}],"id":"fact-1bfe379c2be90f8eaf711ae1a96cc5355b9de5a236915b9e44d9c1b872a23382","kind":"experience","metrics":{"already_satisfied_count":0,"cancelled_step_count":0,"confirmed_effect_count":5,"effect_unknown_count":0,"failed_effect_count":0,"failed_or_rejected_step_count":0,"game_success_inferred_from_input":false,"partial_input_count":0,"released_input_count":5,"simulated_input_count":0},"sample_count":5,"scope":{"calibration_id":"retail-bag-4k-buttons-v2","journal_complete":true,"layout":"3840x2160","mode":"live","panel":"inventory","skill":"close_panel","test_target":false},"statement":"此技能的输入、观察效果与失败反例分别记录；步骤完成不能代替游戏效果确认。"},{"certainty":"observed","counterexamples":5,"evidence":[{"artifact_ids":["image-471506b0-de28-44e6-bb9b-ae706e35b161-0","image-471506b0-de28-44e6-bb9b-ae706e35b161-1"],"observation_ids":["observation-0","observation-1"],"record_seq":23,"source_id":"source-e86455e4a865e4b50486bcfe604a6ea6a8e5e8dbb9b49f7c455e65608c2a3c1d"},{"artifact_ids":["image-471506b0-de28-44e6-bb9b-ae706e35b161-10","image-471506b0-de28-44e6-bb9b-ae706e35b161-11"],"observation_ids":["observation-10","observation-11"],"record_seq":124,"source_id":"source-e86455e4a865e4b50486bcfe604a6ea6a8e5e8dbb9b49f7c455e65608c2a3c1d"},{"artifact_ids":["image-471506b0-de28-44e6-bb9b-ae706e35b161-20","image-471506b0-de28-44e6-bb9b-ae706e35b161-21"],"observation_ids":["observation-20","observation-21"],"record_seq":225,"source_id":"source-e86455e4a865e4b50486bcfe604a6ea6a8e5e8dbb9b49f7c455e65608c2a3c1d"},{"artifact_ids":["image-471506b0-de28-44e6-bb9b-ae706e35b161-30","image-471506b0-de28-44e6-bb9b-ae706e35b161-31"],"observation_ids":["observation-30","observation-31"],"record_seq":325,"source_id":"source-e86455e4a865e4b50486bcfe604a6ea6a8e5e8dbb9b49f7c455e65608c2a3c1d"},{"artifact_ids":["image-471506b0-de28-44e6-bb9b-ae706e35b161-40","image-471506b0-de28-44e6-bb9b-ae706e35b161-41"],"observation_ids":["observation-40","observation-41"],"record_seq":426,"source_id":"source-e86455e4a865e4b50486bcfe604a6ea6a8e5e8dbb9b49f7c455e65608c2a3c1d"}],"id":"fact-23027f06a608879b45c00c40683b2fcb8e99ecc7849c0ab407c7809a079fb375","kind":"experience","metrics":{"already_satisfied_count":0,"cancelled_step_count":0,"confirmed_effect_count":0,"effect_unknown_count":5,"failed_effect_count":0,"failed_or_rejected_step_count":0,"game_success_inferred_from_input":false,"partial_input_count":0,"released_input_count":5,"simulated_input_count":0},"sample_count":5,"scope":{"journal_complete":true,"layout":"3840x2160","mode":"live","skill":"move_for","test_target":false},"statement":"此布局中的运动技能游戏效果未得到确认；完整输入回执不能证明到达、转向完成或击杀。"},{"certainty":"inferred","counterexamples":4,"evidence":[{"artifact_ids":["image-79124bc2-3e29-4fab-ba55-e7b18e725b1b-2","image-79124bc2-3e29-4fab-ba55-e7b18e725b1b-3"],"observation_ids":["observation-2","observation-3"],"record_seq":44,"source_id":"source-c7878a8c3979ff971363ac2d02dcdee58548988fb75ad64d75509738a3987c1a"},{"artifact_ids":["image-79124bc2-3e29-4fab-ba55-e7b18e725b1b-11","image-79124bc2-3e29-4fab-ba55-e7b18e725b1b-12"],"observation_ids":["observation-11","observation-12"],"record_seq":132,"source_id":"source-c7878a8c3979ff971363ac2d02dcdee58548988fb75ad64d75509738a3987c1a"},{"artifact_ids":["image-79124bc2-3e29-4fab-ba55-e7b18e725b1b-21","image-79124bc2-3e29-4fab-ba55-e7b18e725b1b-22"],"observation_ids":["observation-21","observation-22"],"record_seq":233,"source_id":"source-c7878a8c3979ff971363ac2d02dcdee58548988fb75ad64d75509738a3987c1a"},{"artifact_ids":["image-79124bc2-3e29-4fab-ba55-e7b18e725b1b-31","image-79124bc2-3e29-4fab-ba55-e7b18e725b1b-32"],"observation_ids":["observation-31","observation-32"],"record_seq":335,"source_id":"source-c7878a8c3979ff971363ac2d02dcdee58548988fb75ad64d75509738a3987c1a"}],"id":"fact-31cac7ce1e23b0ddc163369e2928c70a009c8ff8321eb8d4963bc299520ed77a","kind":"experience","metrics":{"authorizes_actions":false,"avoid_movement":true,"effect_unknown_count":4,"recommended_wait_ms":250,"requires_arrival_evidence":true},"sample_count":4,"scope":{"journal_complete":false,"layout":"3840x2160","mode":"live","skill":"turn_for","test_target":false},"statement":"在缺少到达观察证据时，建议等待或升级感知；该建议不授权动作，也不证明运动失败。"},{"certainty":"observed","counterexamples":1,"evidence":[{"artifact_ids":["image-79124bc2-3e29-4fab-ba55-e7b18e725b1b-6"],"observation_ids":["observation-6"],"record_seq":72,"source_id":"source-c7878a8c3979ff971363ac2d02dcdee58548988fb75ad64d75509738a3987c1a"},{"artifact_ids":["image-79124bc2-3e29-4fab-ba55-e7b18e725b1b-15","image-79124bc2-3e29-4fab-ba55-e7b18e725b1b-16"],"observation_ids":["observation-15","observation-16"],"record_seq":172,"source_id":"source-c7878a8c3979ff971363ac2d02dcdee58548988fb75ad64d75509738a3987c1a"},{"artifact_ids":["image-79124bc2-3e29-4fab-ba55-e7b18e725b1b-25","image-79124bc2-3e29-4fab-ba55-e7b18e725b1b-26"],"observation_ids":["observation-25","observation-26"],"record_seq":273,"source_id":"source-c7878a8c3979ff971363ac2d02dcdee58548988fb75ad64d75509738a3987c1a"},{"artifact_ids":["image-79124bc2-3e29-4fab-ba55-e7b18e725b1b-35"],"observation_ids":["observation-35"],"record_seq":363,"source_id":"source-c7878a8c3979ff971363ac2d02dcdee58548988fb75ad64d75509738a3987c1a"}],"id":"fact-35ba8dc9bc2098596be3c0a7de11f2fa32f22824b4b6aac9b618bae8a01e8321","kind":"experience","metrics":{"already_satisfied_count":1,"cancelled_step_count":0,"confirmed_effect_count":2,"effect_unknown_count":1,"failed_effect_count":0,"failed_or_rejected_step_count":1,"game_success_inferred_from_input":false,"partial_input_count":0,"released_input_count":2,"simulated_input_count":0},"sample_count":4,"scope":{"calibration_id":"retail-bag-4k-v1","journal_complete":false,"layout":"3840x2160","mode":"live","panel":"inventory","skill":"open_panel","test_target":false},"statement":"此技能的输入、观察效果与失败反例分别记录；步骤完成不能代替游戏效果确认。"},{"certainty":"observed","counterexamples":0,"evidence":[{"artifact_ids":["image-471506b0-de28-44e6-bb9b-ae706e35b161-6","image-471506b0-de28-44e6-bb9b-ae706e35b161-7"],"observation_ids":["observation-6","observation-7"],"record_seq":84,"source_id":"source-e86455e4a865e4b50486bcfe604a6ea6a8e5e8dbb9b49f7c455e65608c2a3c1d"},{"artifact_ids":["image-471506b0-de28-44e6-bb9b-ae706e35b161-16","image-471506b0-de28-44e6-bb9b-ae706e35b161-17"],"observation_ids":["observation-16","observation-17"],"record_seq":185,"source_id":"source-e86455e4a865e4b50486bcfe604a6ea6a8e5e8dbb9b49f7c455e65608c2a3c1d"},{"artifact_ids":["image-471506b0-de28-44e6-bb9b-ae706e35b161-26","image-471506b0-de28-44e6-bb9b-ae706e35b161-27"],"observation_ids":["observation-26","observation-27"],"record_seq":285,"source_id":"source-e86455e4a865e4b50486bcfe604a6ea6a8e5e8dbb9b49f7c455e65608c2a3c1d"},{"artifact_ids":["image-